category,headline,summary,link
Politics,Kuenssberg: Are Tories resigned to electoral fate under Sunak?,Tory MPs are in no mood to oust Rishi Sunak despite local results pointing to general election defeat.,/news/uk-politics-68956828
Politics,Chris Mason: An evening of drama as Labour squeak West Midlands win,"Labour won with just over 1,500 votes more than the Tories in an incredibly close race.",/news/uk-politics-68959732
Politics,How Sadiq Khan won over London for the third time,The Labour candidate clinched a third-successive term as mayor of London - but what next?,/news/uk-england-london-68959313
Politics,Sir John Curtice: Do local election results point to a hung Parliament?,Using how people voted in local elections to predict a potential general election result poses difficulties.,/news/uk-politics-68964302
Politics,"Watch: Labour puts country first, party second - Starmer",Labour leader Sir Keir Starmer says the UK would not be less safe under a Labour government.,/news/uk-politics-69002974
Politics,Is it 'better the devil you know?' Chris Mason asks PM,"People in Britain need to know there is a ""secure future for them"" Rishi Sunak tells the BBC's political editor.",/news/uk-politics-69002971
Politics,Natalie Elphicke: Sunak has failed on small boats,"The MP for Dover who defected to Labour last week, says small boat arrivals are at a record high.",/news/uk-politics-68990670
Politics,Sunak ultimately responsible for Tory chaos - Houchen,"Ben Houchen admits ""things don't look great for the Conservative Party at the moment"".",/news/uk-politics-68983904
Politics,Watch: Elphicke apologises to ex-husband's victims,The ex-husband of MP Natalie Elphicke - who defected to Labour - was found guilty of sexually assault in 2020.,/news/uk-politics-68987088
Politics,Chris Mason: Welcome to the Sunak and Starmer show,The prime minister and opposition leader are road testing their messages ahead of the general election.,/news/articles/cyerz0wp2ero
Politics,How foreign affairs could shape votes at home,"Former, current and would-be foreign secretaries set out their pitch for Britain and the world.",/news/articles/crgy9qpdr8go
Politics,The inside story of Tory MP's defection to Labour,Keir Starmer's allies believe the Dover MP can help win Tory voters but some on the left are uneasy.,/news/uk-politics-68979548
Politics,Election poll tracker: How do the parties compare?,How do people say they will vote in the UK general election? Our poll tracker measures the trends.,/news/uk-politics-68079726
Politics,When is the next general election?,"The next UK general election has to be held by 28 January 2025, but could take place earlier.",/news/uk-politics-62064552
